url,type,title,category,subcategory,votes,private,created_at,text,user_from,user_from_role,user_to,user_to_role,thread_id
https://us.edstem.org/courses/2345/discussion/141244?comment=429423,post,recover original work/imdb_tr.sample.csv,Assignments,Assignment 5,0,False,2020-11-18T06:14:49.242365+11:00,"The above is what's in the downloaded imdb_tr.sample.csv file.

",allan 5050,,allan 5050,,2345/discussion/141244
https://us.edstem.org/courses/2345/discussion/141356,post,data structures,Assignments,Assignment 1,3,False,2020-10-06T01:08:59.782752+11:00,"Ok so, I found these readings useful, or a good starting point, when trying to implement adequate data structures 

https://en.wikipedia.org/wiki/List_of_data_structures

https://docs.python.org/3.6/contents.html

https://wiki.python.org/moin/TimeComplexity

",PedroLimaSousa,,,,2345/discussion/141356
https://us.edstem.org/courses/2345/discussion/141356?comment=349198,post,data structures,Assignments,Assignment 1,3,False,2020-10-06T02:57:16.162505+11:00,"These links are great. As for more resources, I'd like to add two books

Introduction to Algorithms, by CLRS: This book has an incredible selection of Data Structures and Algorithms, and is usually used in an Advanced Algorithms class.

https://www.amazon.com/Introduction-Algorithms-3rd-MIT-Press/dp/0262033844

Artificial Intelligence, A Modern Approach: This book is a must have if you are serious about Artificial Intelligence. This book covers so much about AI from classical methods, to probabilistic methods, to RL, NLP and Computer Vision and Robotics. It is a great introduction to the field if you are starting out.

https://www.amazon.com/Artificial-Intelligence-A-Modern-Approach/dp/0134610997/ref=sr_1_3?dchild=1&keywords=artificial+Intelligence&qid=1601913397&s=books&sr=1-3

Hope this helps!",Ashvin,admin,PedroLimaSousa,,2345/discussion/141356
https://us.edstem.org/courses/2345/discussion/141356?comment=351503,post,data structures,Assignments,Assignment 1,0,False,2020-10-07T05:36:12.541018+11:00,"I just got my copy of ""Artificial Intelligence, A Modern Approach"". It is long! over 1000 pages! It will keep me busy for a long time....",Juan_M_Arias,,Ashvin,admin,2345/discussion/141356
https://us.edstem.org/courses/2345/discussion/141356?comment=477900,post,data structures,Assignments,Assignment 1,0,False,2020-12-30T03:57:49.094281+11:00,"that's sure for me too..... so hope be in touch!

",Hari Danse,,Juan_M_Arias,,2345/discussion/141356
https://us.edstem.org/courses/2345/discussion/141714,question,Anyone working on Mac OS 10.15.5 (Catalina),Assignments,Assignment 1,0,False,2020-10-06T09:32:50.999731+11:00,"Hello there,

I was wondering if anyone is working with Anaconda (Latest version) on Catalina?. I have not been able to install Git yet...Any suggestions?



Cheers

R",rrocy,,,,2345/discussion/141714
https://us.edstem.org/courses/2345/discussion/141714?answer=351297,answer,Anyone working on Mac OS 10.15.5 (Catalina),Assignments,Assignment 1,0,False,2020-10-07T03:34:30.219337+11:00,What trouble are you having?,Tanvi Hisaria,admin,rrocy,,2345/discussion/141714
https://us.edstem.org/courses/2345/discussion/141714?comment=358138,answer,Anyone working on Mac OS 10.15.5 (Catalina),Assignments,Assignment 1,0,False,2020-10-10T03:45:34.200014+11:00,"Hello Tanvi, 



It was just an issue of installing Development Tools, but I got them from the Dev Site :)

",rrocy,,Tanvi Hisaria,admin,2345/discussion/141714
https://us.edstem.org/courses/2345/discussion/141714?answer=351476,answer,Anyone working on Mac OS 10.15.5 (Catalina),Assignments,Assignment 1,1,False,2020-10-07T05:21:03.396513+11:00,"I am using 10.15.7. I didn't have any issues installing Anaconda. I used Anaconda Explorer to install git.  I didn't have any issues with that either. 

",Juan_M_Arias,,rrocy,,2345/discussion/141714
https://us.edstem.org/courses/2345/discussion/141714?comment=358137,answer,Anyone working on Mac OS 10.15.5 (Catalina),Assignments,Assignment 1,0,False,2020-10-10T03:44:56.433046+11:00,"Anaconda runs fine...I was trying to run other code that required the Developer Tools and I was having issues with the installation. However, I found access to the Dev Tools via their Development Site. Here is the link in case anyone needs to get access to it too ;)

https://developer.apple.com/download/more/

",rrocy,,Juan_M_Arias,,2345/discussion/141714
https://us.edstem.org/courses/2345/discussion/141714?answer=359585,answer,Anyone working on Mac OS 10.15.5 (Catalina),Assignments,Assignment 1,0,False,2020-10-11T01:58:27.264643+11:00,"Link to the download for the Development tools https://developer.apple.com/download/more/

",rrocy,,rrocy,,2345/discussion/141714
https://us.edstem.org/courses/2345/discussion/141967,question,MemoryError,Assignments,Assignment 5,1,False,2020-10-06T15:34:15.450535+11:00,"""MemoryEorror"" encountered when trying to convert the result of the vectorizer.fit.transorm() to array (for subsequent passing to SGDClassifier.fit()) .  Understand that it should be due to the huge size of the vocab (118350).

Any hint?

X = vectorizer.fit_transform(corpus)

X = X.toarray() ...................MemoryError",JeffreyYau,,,,2345/discussion/141967
https://us.edstem.org/courses/2345/discussion/141967?comment=350895,question,MemoryError,Assignments,Assignment 5,2,False,2020-10-06T21:48:25.848857+11:00,Problem solved.  No need to convert toarray().,JeffreyYau,,JeffreyYau,,2345/discussion/141967
https://us.edstem.org/courses/2345/discussion/142283,post,Vocareum Walkthrough,Assignments,Assignment 1,0,False,2020-10-07T03:53:35.269005+11:00,"Hi,

This is my first time using vocareum. Is it only used for submitting the assignments or can we also write and run the program on vocareum.If yes, i am not getting any run option to execute the code. Can anyone just walk me through this vocareum workbench.

",Hemanth09_,,,,2345/discussion/142283
https://us.edstem.org/courses/2345/discussion/142283?comment=351483,post,Vocareum Walkthrough,Assignments,Assignment 1,1,False,2020-10-07T05:24:27.075778+11:00,"Vocareum is not very intuitive. First time for me as well, but what I figured out is that you can upload the program or files that you want, and you can run them like you would using a terminal on your PC or Mac. You should see a list of files / directory on the left, and a terminal prompt on the right (bottom section). You can basically type python3 xxxx and that would execute the program. You can create folders, rename files, upload files from your computer. 

I hope this helps.",Juan_M_Arias,,Hemanth09_,,2345/discussion/142283
https://us.edstem.org/courses/2345/discussion/142283?comment=360909,post,Vocareum Walkthrough,Assignments,Assignment 1,0,False,2020-10-11T23:26:50.390201+11:00,"When you're generating the output.txt file, you'll need to refresh your browser window the first time the file is generated. For every subsequent update you can click on your driver.py file then click back to output.txt to see the update.",allan 5050,,Hemanth09_,,2345/discussion/142283
https://us.edstem.org/courses/2345/discussion/142768,question,When will the Machine Learning course be offered again?,General,,0,False,2020-10-07T13:13:44.932863+11:00,"I'm really enjoying this course - it's really broad and touches a ton of topics, with very interesting reading assignments to go along. I would like to attempt the next course in the Micromasters (Machine Learning) after this, and was wondering about the schedule. Will it be offered sometime in January as part of the Spring semester?",p_george,,,,2345/discussion/142768
https://us.edstem.org/courses/2345/discussion/142768?comment=353118,question,When will the Machine Learning course be offered again?,General,,1,False,2020-10-08T00:18:49.234906+11:00,"Hi p_pgeorge, 

Thank you for your interest and we are still having an internal discussion about the schedule next year. Sorry I do not know the plan for 2021 yet, but once it is finalized, it will be updated on the edX site. We will keep you posted. Thank you for your patience. 



Cheers, 

Shu-Yi",Shu-Yi,admin,p_george,,2345/discussion/142768
https://us.edstem.org/courses/2345/discussion/142801,question,Good resource for more programming challenges,General,,0,False,2020-10-07T13:59:00.472405+11:00,"We're learning a lot of concepts in each lecture, but only implement a small part of it in code. I understand that this is because of logistic limitations of the grading platform, but was wondering if there are good resources for more problems without the grading option. Some place where a  problem statement along with a good dataset is readily available. Do share if anyone finds any resources.",p_george,,,,2345/discussion/142801
https://us.edstem.org/courses/2345/discussion/142801?answer=353432,answer,Good resource for more programming challenges,General,,1,False,2020-10-08T04:16:01.157857+11:00,Kaggle has a bunch of great data science problems for you to practice more Machine Learningrelated problems!,Tanvi Hisaria,admin,p_george,,2345/discussion/142801
https://us.edstem.org/courses/2345/discussion/143086,question,Dumb Question about the solution,Assignments,Assignment 1,0,False,2020-10-07T21:52:39.215241+11:00,"Hi, 

I have a really simple question about the puzzle. The solution showed for the puzzle in the example is:

0,1,2,3,4,5,6,7,8

Is this the only solution to consider for this project?

For example 1,2,3,4,5,6,7,8,0 is not a correct solution, right? 0 must always be at the start (?).

Thank you!

",RLZZ,,,,2345/discussion/143086
https://us.edstem.org/courses/2345/discussion/143086?answer=353435,answer,Dumb Question about the solution,Assignments,Assignment 1,2,False,2020-10-08T04:18:52.791491+11:00,"Yes, for this assignment consider 0,1,2,3,4,5,6,7,8 to be the only goal state.",Tanvi Hisaria,admin,RLZZ,,2345/discussion/143086
https://us.edstem.org/courses/2345/discussion/143097,post,psutil has no max memory function,Assignments,Assignment 1,0,False,2020-10-07T22:34:12.466924+11:00,"Memory usage measurement is of course optional, but I found that Windows users must install and use psutil (a standard Python library) to get memory usage because the skeleton code's provided ""import resource"" only works on MacOS / Linux systems. However psutil doesn't have a peak memory measurement function like resource does, so I'd have to use a 3rd party library.

My problem now though is how the instructions imply there's a lot of risk in trying 3rd party libraries:

The FAQ says under Q. (Windows Users) Is there ""resource"" module in Windows?, ""one possible workaround is to use third-party module only if the machine is Windows:""

However this contradicts the lesson instructions which state: ""In particular, do not use third-party libraries and packages. We do not guarantee that they will work on the platform, even if they work on your personal computer. For the purposes of this project, everything that comes with the standard Python library should be more than sufficient.""

I couldn't find any standard Python libraries that support peak memory measurement for Windows. Because of how strict the lesson instructions are everywhere, I don't feel comfortable trying any 3rd party libraries and risking that the grader errors out on them. Perhaps the lesson could include a supported 3rd party memory library for Windows users that it can guarantee won't fail in the grader?

",allan 5050,,,,2345/discussion/143097
https://us.edstem.org/courses/2345/discussion/143097?comment=353066,post,psutil has no max memory function,Assignments,Assignment 1,1,False,2020-10-07T23:38:25.20164+11:00,"Can you try coding this part in Vocareum itself? Since it doesn't count towards the final score, I think some inaccuracy would be acceptable.",p_george,,allan 5050,,2345/discussion/143097
https://us.edstem.org/courses/2345/discussion/143097?comment=353079,post,psutil has no max memory function,Assignments,Assignment 1,1,False,2020-10-07T23:52:28.661224+11:00,"Interesting idea, thanks! I might try this. Vocareum is in the cloud and likely Linux based, so resource might work there. I've been developing on a local IDE in Windows so I haven't yet tested this.

",allan 5050,,p_george,,2345/discussion/143097
https://us.edstem.org/courses/2345/discussion/143097?comment=364061,post,psutil has no max memory function,Assignments,Assignment 1,1,False,2020-10-13T14:53:15.013479+11:00,"Hi there,

I think you'll be fine with the psutil library to get information. Can you try and see if this works?

import psutil

print(""Memory usage: {}"".format(psutil.Process().memory_info().rss))
",Ashvin,admin,allan 5050,,2345/discussion/143097
https://us.edstem.org/courses/2345/discussion/143097?comment=364620,post,psutil has no max memory function,Assignments,Assignment 1,0,False,2020-10-13T23:20:25.65678+11:00,"I've been using this, but doubt it measures actual peak usage across the entire session. I think it only measures memory usage when the line of code is run.

I tried doing peak_wset for memory_info() per this documentation, but it didn't work.

Anyhow, I'm done with the assignment and got 100% since memory wasn't graded. However, perhaps a future version of the course can offer a working peak memory monitoring method for Windows users. :-)

",allan 5050,,Ashvin,admin,2345/discussion/143097
https://us.edstem.org/courses/2345/discussion/143871,question,What Python type is recommended for the queue/stack in Assignment 1?,General,,0,False,2020-10-08T13:44:50.080023+11:00,"Hello everyone!

I'm using the skeleton code to get started, which imports the queue library.  However, it looks like queue does not allow for a membership test when expanding the frontier.  This means that if I use a queue, I run the risk of inserting the same mode twice.  I'm thinking that it would be better to use a list and treat it as a queue, but not sure about speed and what is industry practice.  Thanks!",David Gallagher,,,,2345/discussion/143871
https://us.edstem.org/courses/2345/discussion/143871?answer=355212,answer,What Python type is recommended for the queue/stack in Assignment 1?,General,,0,False,2020-10-08T15:18:06.035906+11:00,"I use both Queue and Set together.  Set is for used for membership checking purpose.

i.e. add/remove item to both Queue and Set.

Also want to know if there is any better method. 

",JeffreyYau,,David Gallagher,,2345/discussion/143871
https://us.edstem.org/courses/2345/discussion/143871?answer=355942,answer,What Python type is recommended for the queue/stack in Assignment 1?,General,,1,False,2020-10-09T02:19:59.47336+11:00,"deque is another good alternative, can be used as a FIFO and LIFO queue. It seems sets and dictionaries are better suited for membership check since both uses hash tables which increases search speed",igopepra,,David Gallagher,,2345/discussion/143871
https://us.edstem.org/courses/2345/discussion/143871?comment=355948,answer,What Python type is recommended for the queue/stack in Assignment 1?,General,,0,False,2020-10-09T02:24:20.137618+11:00,"Yes - I was thinking that maybe the queue could be used for the frontier since it is fast, and maybe the explored set could include the board information for everything in the frontier and explored.  That way the membership search would only need to check one place.  I'm sure this would work, but am not sure if it is allowed by the parameters of the assignment.",David Gallagher,,igopepra,,2345/discussion/143871
https://us.edstem.org/courses/2345/discussion/143871?comment=355975,answer,What Python type is recommended for the queue/stack in Assignment 1?,General,,0,False,2020-10-09T02:42:23.656173+11:00,"I guess it is allowed while getting right results within the given time constraints, it is a matter of coding, testing and debugging, good luck!",igopepra,,David Gallagher,,2345/discussion/143871
https://us.edstem.org/courses/2345/discussion/143871?answer=356292,answer,What Python type is recommended for the queue/stack in Assignment 1?,General,,0,False,2020-10-09T05:18:01.890991+11:00,The options suggested by other students are all great!,Tanvi Hisaria,admin,David Gallagher,,2345/discussion/143871
https://us.edstem.org/courses/2345/discussion/143871?answer=359598,answer,What Python type is recommended for the queue/stack in Assignment 1?,General,,0,False,2020-10-11T02:22:37.79685+11:00,"I have used set for explored list, I saw some documentation and posts claiming up to 20x faster than queue. It really increased the performance for me.

I used deque from collections. According to my research, queue uses collections under the hood, some unnecessary overhead (if what you use are only appends and pop's).",fer_goldbach,,David Gallagher,,2345/discussion/143871
https://us.edstem.org/courses/2345/discussion/143871?comment=359754,answer,What Python type is recommended for the queue/stack in Assignment 1?,General,,1,False,2020-10-11T05:07:40.333242+11:00,"Yes - I ended up using set for explored and a parallel set for the search aspects of the frontier.  Very fast!  I saw some claim on line that sets were 100,000+ times faster than lists for membership check.  Seems hyperbolic, but I will say that every search takes less than 5 seconds with sets, whereas I cut off the program after 3 minutes using a list.  :)",David Gallagher,,fer_goldbach,,2345/discussion/143871
https://us.edstem.org/courses/2345/discussion/144189,question,Is UCS actually a Dijkstra algorithm in disguise?,General,,0,False,2020-10-08T17:50:31.529661+11:00,"Hello,

For me the idea of UCS explains how the Dijkstra algorithm for finding the shortest paths works. Am I'm missing something important about UCS method?



Thanks,

Alexander",agorodnev,,,,2345/discussion/144189
https://us.edstem.org/courses/2345/discussion/144189?answer=356298,answer,Is UCS actually a Dijkstra algorithm in disguise?,General,,0,False,2020-10-09T05:21:41.134199+11:00,"They are similar in implementation, but have different goals. UCS is searching for the ""goal"" state, where Dijkstra is searching for the shortest path to every other node in the graph.",Tanvi Hisaria,admin,agorodnev,,2345/discussion/144189
https://us.edstem.org/courses/2345/discussion/144296,question,Questions about matrices,Lectures,W5,1,False,2020-10-08T19:47:43.149297+11:00,"Hi,

I have a question about this slide.

Video: 5.4 Linear Models for Regression/ Normal Equation and Gradient Descent

a. I'm not very good with differentiating matrices. In (4), I don't understand where the - (minus) sign comes from. When I calculate, the two minuses from (3) cancel out (-1/n and -X/B) so I end up with a positive sign in (4). Other than the wrong sign, I find the correct equation.

b. I don't really understand why the second derivative indicates that the matrix is positive definite, and why that indicates that B is a minimum.

Thanks for your help!",JulienVM,,,,2345/discussion/144296
https://us.edstem.org/courses/2345/discussion/144296?answer=365220,answer,Questions about matrices,Lectures,W5,0,False,2020-10-14T06:57:49.429398+11:00,"Hi there,

What this really boils down to is differentiating matrices and a little bit of insight on what we are trying to achieve, and if you spend a little bit of time getting comfortable with them, you'll see how the math works out. 

What I am going to do is point you in the right direction. Hopefully if you work through the following two resources, the differentiation of matrices within the context of Least Squares should make more sense. 

The Matrix Cookbook is a good resource that I recommend everyone interested in Machine Learning go through. It will walk you through Matrix operations in general, the section on Second Order Derivatives on page 11 will specifically help you understand the normal equations. If you have time, I recommend skimming through the whole book.

Understanding OLS within the context of Econometrics might be a good idea. This paper lies outside of the scope of our class(because it is related to Econometrics), but the derivation of the normal equation is identical to what we are doing here. Note that the terminology may be slightly different, but the idea is the same.

I really encourage you to work through these two resources on your own, because having a robust understanding of Matrix properties(and a little bit of interdisciplinary knowledge) will go a long way! If you still have some issues after that, we can work through them together. ",Ashvin,admin,JulienVM,,2345/discussion/144296
https://us.edstem.org/courses/2345/discussion/144296?comment=367402,answer,Questions about matrices,Lectures,W5,0,False,2020-10-15T07:34:30.684698+11:00,"Hi, great resources, thanks. I also wondered if I should review matrix operations",RBBACKAL,,Ashvin,admin,2345/discussion/144296
https://us.edstem.org/courses/2345/discussion/144300,question,Course availability past December?,General,,1,False,2020-10-08T19:50:33.379676+11:00,"Hi, I have a family emergency unfolding as I'm taking this course. I'm on the verified track.

Will I still be able to access the course materials (e.g. videos, instructions) on EdX past the ""Course End"" date of Dec. 22nd? 

Or, will my access and progress be shut off and reset?

I'm not concerned about a certificate as I am about the actual learning.

Thanks,

Allan",allan 5050,,,,2345/discussion/144300
https://us.edstem.org/courses/2345/discussion/144300?comment=358037,question,Course availability past December?,General,,0,False,2020-10-10T02:30:20.896002+11:00,I will like a response to this question. Optimizing the projects is my priority beyond the Certificate. I want to become an authority in the field of AI and go beyond this course.,Olumuy,,allan 5050,,2345/discussion/144300
https://us.edstem.org/courses/2345/discussion/144300?answer=358158,answer,Course availability past December?,General,,1,False,2020-10-10T03:58:55.183473+11:00,"Hi Allan,

I hope everything is ok and thank you for checking in with us. To answer your questions:

Yes, you will be able to access all the course lecture videos after the course ends (12/22). But, you won’t have access to the coding platform and be able to submit any assignments and quizzes after the deadline. 

You are more than welcomed to take the course again, but you need to pay again to re-enroll in the verified track for the next run. Also, no course records can be transferred. If you want to consider un-enroll to get a refund, you can check the refund policy. 

Let me know if you have any other questions. Best wishes to you and your family!

Best,
JW",Joowon,admin,allan 5050,,2345/discussion/144300
https://us.edstem.org/courses/2345/discussion/144387,question,How do i make the queue store more than one element?,Assignments,Assignment 1,0,False,2020-10-08T22:13:44.135174+11:00,"Hi,

I have a problem that is blocking my BFS search. My frontier queue is only keeping the last element that I add to the queue. 

def bfs_search(initial_state):

    """"""BFS search""""""

    ### STUDENT CODE GOES HERE ###
    'Initialisation of the variables'
    frontier = Q.Queue(maxsize=0)
    frontier.put(initial_state)
    explored = set()
    iterations = 0
    
    'Search loop'
    while not frontier.empty():
        iterations+=1
        print('Queue Status')
        for i in list(frontier.queue):
            print(i.config)
        
        state = frontier.get()
        print('Taken from queue: ',state.config)
        explored.add(state.config)
        if test_goal(state):
            return state
        for neighbour in state.expand():
            if not element_in_queue(neighbour,frontier):
                if not neighbour.config in explored:
                    frontier.put(neighbour)
                    print('Added to queue: ',neighbour.config)
        print('Iteration number: ',iterations)

When I try to add the neighbours that have not been visited yet, even though I get the confirmation that the code has been run and they were added, the queue just has one element which corresponds to the last one to be added. I don't know if i am missing something important in the queue definition but it makes it impossible to run the search as it only keeps one node.

Thank you in advance.

PD: I tested it with a very simple case, where the solution is just 'LEFT'.

'1,0,2,3,4,5,6,7,8'



Effectively the three possible nodes are added to the queue, but when I make the queue.get() I just get the last node added.

",RLZZ,,,,2345/discussion/144387
https://us.edstem.org/courses/2345/discussion/144387?comment=355747,question,How do i make the queue store more than one element?,Assignments,Assignment 1,1,False,2020-10-08T23:06:22.980039+11:00,"After some more investigation I think the problem comes from checking if the element is in the queue or not. If I just check if it is on the explored set it works, but if I  check if it is on the queue it deletes other elements when going through the queue. 

Queues are not iterable, so you can't just say 'If neighbour in frontier'. 



",RLZZ,,RLZZ,,2345/discussion/144387
https://us.edstem.org/courses/2345/discussion/144387?answer=355732,answer,How do i make the queue store more than one element?,Assignments,Assignment 1,0,False,2020-10-08T22:43:22.378794+11:00,Why you initialize your Queue with maxsize = 0?,JeffreyYau,,RLZZ,,2345/discussion/144387
https://us.edstem.org/courses/2345/discussion/144387?comment=355745,answer,How do i make the queue store more than one element?,Assignments,Assignment 1,0,False,2020-10-08T23:03:32.26083+11:00,"I was trying to make sure the queue has infinite size, but it doesn't change anything. If you just initialize with queue() it should be infinite by default.",RLZZ,,JeffreyYau,,2345/discussion/144387
