url,type,title,category,subcategory,votes,private,created_at,text,user_from,user_from_role,user_to,user_to_role,thread_id
https://us.edstem.org/courses/2345/discussion/108647,announcement,Welcome,General,,1,False,2020-08-19T06:46:30.856664+10:00,"Hi everyone,

We're using Ed Discussion for Q&A this semester.

This is the best place to ask questions about the course, whether curricular or administrative. You will get faster answers here from staff and peers than through email.

Here are some tips:

Search before you post

Heart questions and answers you find useful

Answer questions you feel confident answering

Share interesting course related content with staff and peers

For more information on Ed Discussion, you can refer to the Quick Start Guide.

All the best this semester!

Shu-Yi

",Shu-Yi,admin,,,2345/discussion/108647
https://us.edstem.org/courses/2345/discussion/129717,post,Discussion Forum Guideline,General,,3,False,2020-09-21T11:09:21.403595+10:00,"Discussion forum Guideline: 
The discussion forums are a way for you to share your thoughts about course material, learn from your fellow students, get to know them better, and report problems.
If you have an urgent matter -- such as needing to report a video or other course component that isn't working properly -- you can get the attention of course staff by creating a new post and putting [STAFF] in the title.
 
There are a few other ways you can participate:
 
Select the ""heart"" icon to like  posts and good responses (so the post will move closer to the top of the discussion thread)
 
Select the “star” icon to follow posts for updates
 
Use “watch” to be notified of all activities in the thread
 
You are part of a diverse learning community that forms the heart of a meaningful learning experience. Be it online or in person, a healthy online learning community starts with some basics:
Be respectful. Please respect your fellow students. Debate and pushing on ideas is part of a healthy and thriving learning community, but only when that is done in a polite and respectful manner. Insulting, condescending or abusive words will not be tolerated and will be reported and removed.
Be constructive. A learning community is about learning with and through engagement with one another. When commenting on others' projects, try to offer constructive feedback and suggestions that help them improve it.
 
Be sensitive. This is a global forum with participants from many different cultures and backgrounds. Be sensitive when discussing race, religion, gender, sexual orientation, or controversial topics since others may be more sensitive about them than you are.
 
Post appropriately. Content that violates the Terms of Service is not permitted. You may not post inappropriate (e.g. pornographic) or copyrighted content, advertise or promote outside products or organizations, or spam the forums with repeated content.
 
Users that repeatedly post inappropriate content (see above) may lose their posting privileges, at the discretion of the course staff.
 
Please help us create a healthy learning environment by respecting these standards. We do not expect to see many of these issues because we trust students like you to keep our forum communities strong and healthy.
 
In addition, please consider the following guidelines when posting in the course forums. These guidelines were created to serve the community and make the forums welcoming and easy to use. If you have other suggestions to add, please let us know!

FORUM POSTING GUIDELINES

What makes a good post? The main goal of the forums is to provide a place where dialogue can build as the collective learning community digs into this content together. The forums are there for all learners to have a deeper, more meaningful learning experience, but there are a few things to consider when posting in the course forums:
 
Read before posting. Your comment or question should build on what’s already been discussed. If you have a question, scan through to see if it’s already been addressed and use the search function to avoid creating duplicate threads and find the most appropriate topic thread to post in.
 
Use informative titles. Keep your post titles short and on-topic so the forums are easier to navigate. If you’re asking a question, it should go in the title.
 
Make it easy to read. Present facts and background in your post. Don’t capitalize or bold entire sentences since this makes the forums harder to read. Check your posts for spelling or grammatical errors.
 
Stay on topic. Don’t change the topic of a thread or split a thread into multiple discussions. If you are discussing something that is not directly related to the course materials, pick one thread instead of discussing over multiple threads. And please, don’t post the same post/question in more than one forum.
 
Help keep the site friendly. Any comment which is mean, insulting, too violent, or otherwise inappropriate will be removed by the staff. 
 
Thanks for keeping the conversation lively and respectful!",Shu-Yi,admin,,,2345/discussion/129717
https://us.edstem.org/courses/2345/discussion/129718,post,How to Manage Your Online Learning?,General,,3,False,2020-09-21T11:09:44.833321+10:00,"Picture source: https://www.learningtimes.com/what-we-do/online-conferences/case-study-ioc/

",Shu-Yi,admin,,,2345/discussion/129718
https://us.edstem.org/courses/2345/discussion/129720,post,"What is ""Weekly Reflection"" ?",General,,0,False,2020-09-21T11:12:46.958272+10:00,"

What is Weekly Reflection?

Weekly Reflection module is designed to help you build a habit of planning your study of the upcoming week. 

It includes 3 sections:

Course Progress*: Review your learning records and self-evaluate your learning progress to adjust your learning strategies

Study Planning*: Set learning goals, to-do tasks and reminders 

Study Tip: comics with some wisdoms to share 



It locates in the beginning of each week and you have to complete Weekly Review before proceeding to the course videos. Click here to checkout the Weekly Review Tutorial. 





Let us know if you have any questions!



p.s The Course Progress and Study Planning are only available for the verified track learners. ",Shu-Yi,admin,,,2345/discussion/129720
https://us.edstem.org/courses/2345/discussion/129720?comment=329950,post,"What is ""Weekly Reflection"" ?",General,,0,False,2020-09-24T10:08:32.892558+10:00,"i am on the verified track; however, the study planning and study tips did not open for me.  Please let me know how i can access these.",tierneyjyoung,,Shu-Yi,admin,2345/discussion/129720
https://us.edstem.org/courses/2345/discussion/129720?comment=330232,post,"What is ""Weekly Reflection"" ?",General,,0,False,2020-09-24T12:06:11.746881+10:00,"Hi there, 

I inspected your account and it seems that you have the study planning and the learning tips page showing correctly. Course Progress is under construction and we are working on restoring it. Sorry for the trouble. ",Shu-Yi,admin,tierneyjyoung,,2345/discussion/129720
https://us.edstem.org/courses/2345/discussion/129720?comment=333276,post,"What is ""Weekly Reflection"" ?",General,,0,False,2020-09-26T06:37:23.546893+10:00,Which browser are you using?  Maybe it does not work for chrome.  These pages still do not open for me.  see attached,tierneyjyoung,,Shu-Yi,admin,2345/discussion/129720
https://us.edstem.org/courses/2345/discussion/129720?comment=333286,post,"What is ""Weekly Reflection"" ?",General,,0,False,2020-09-26T06:50:22.342796+10:00,"Hi, Apologizing that weekly review is a beta version we are.launching and.currently it is down for repairment. I will keep you posted when it is working. Sorry for the inconvenience. ",Shu-Yi,admin,tierneyjyoung,,2345/discussion/129720
https://us.edstem.org/courses/2345/discussion/129720?comment=363594,post,"What is ""Weekly Reflection"" ?",General,,0,False,2020-10-13T09:24:30.70975+11:00,is this working yet?  I am still getting the error messages as seen in the screen shots shown above from 17 days ago.,tierneyjyoung,,Shu-Yi,admin,2345/discussion/129720
https://us.edstem.org/courses/2345/discussion/129720?comment=363634,post,"What is ""Weekly Reflection"" ?",General,,0,False,2020-10-13T09:48:02.184875+11:00,"Hi Tiereyjyoung, 

Weekly Reflection starts to operate in W2. Here is the screenshot I got when inspecting your account. Pls let   me know if you have trouble viewing it. Thanks. 

",Shu-Yi,admin,tierneyjyoung,,2345/discussion/129720
https://us.edstem.org/courses/2345/discussion/129720?comment=342275,post,"What is ""Weekly Reflection"" ?",General,,0,False,2020-10-02T06:31:25.824801+10:00,"Question: Have I missed any deadlines?  I just found out about this course and I'm very interested, but I'd like to be sure I can actually do the whole thing before shelling out for a Verified track.",DR_Darnell,,Shu-Yi,admin,2345/discussion/129720
https://us.edstem.org/courses/2345/discussion/129720?comment=342397,post,"What is ""Weekly Reflection"" ?",General,,0,False,2020-10-02T07:27:35.463931+10:00,"Hi Dr_Darnell, 

No, you have not missed any deadline yet. 

Here are all the deadlines: 

Verification due 12/11/2020

Assignments & Quizzes due 12/13

Courses ends 12/21/2020

Certificate available 1/3/2021



Please read through the getting started section to learn more about the logistics information Course information

All students (verified and audit) have access to the lectures and self-assessments. However, only verified students have additional access to the graded assessments such as weekly quizzes, projects and the final exam. 

For the audit track learners, if you are considering to upgrade, you can take advantage of the 14-day full refund policy to sample the course. If you do not earn a passing grades, you can come back to join us again in the future run. 

Please note that one has to pay again to join the verified track and no course records will carry over.I hope this answers your question. If you have any questions, please let us know. 



Also, please tag your questions with  [General] or [Lecture] properly so your posts would be reviewed & answered in a timely manner. 

Thank you and welcome to the course. 



Shu-Yi




",Shu-Yi,admin,DR_Darnell,,2345/discussion/129720
https://us.edstem.org/courses/2345/discussion/129720?comment=356004,post,"What is ""Weekly Reflection"" ?",General,,0,False,2020-10-09T02:55:06.477636+11:00,"Hello, does ""Weekly Reflection"" which is to ""help you build a habit of planning your study of the upcoming week"" affect our final score in the course if we don't do it? Can it please be made to be an optional tool for those who want and need it?

Just my 2 cents of feedback about this: If someone doesn't have proper study habits and voluntarily signs up for a graduate level MOOC and fails to do their assignments in the specified time frame, then they should fail. I hope that study habit fundamentals can be an unsaid prerequisite of people attending the course (just like calculus, linear algebra, python), and if they need the help they can find many free resources online (e.g. for time management). Personally I graduated university while doing 2+ years 100% online and didn't need this help. Making basic time management and study habits a prerequisite and this reflection optional will give people more time to study more about AI or Python. 

Thanks! :-)",allan 5050,,Shu-Yi,admin,2345/discussion/129720
https://us.edstem.org/courses/2345/discussion/129720?comment=356033,post,"What is ""Weekly Reflection"" ?",General,,1,False,2020-10-09T03:15:27.07532+11:00,"Hi Allan, 

You don't have to do it if you don't want to. I am glad that you feel confident and well equipped with the knowledge and experience to navigate through the online courses. Hope you enjoy the course and let us know if you have any other questions. 

Shu-Yi",Shu-Yi,admin,allan 5050,,2345/discussion/129720
https://us.edstem.org/courses/2345/discussion/129720?comment=356049,post,"What is ""Weekly Reflection"" ?",General,,0,False,2020-10-09T03:22:28.328501+11:00,"Thank you so much Shu-Yi! :-)

",allan 5050,,Shu-Yi,admin,2345/discussion/129720
https://us.edstem.org/courses/2345/discussion/129753,question,Multiple submission for project,General,,0,False,2020-09-21T12:01:34.118056+10:00,"Can we Submit out projects multiple time for grading? Is there any penalty for not getting it right on the first try?

",EAnubhavR,,,,2345/discussion/129753
https://us.edstem.org/courses/2345/discussion/129753?answer=325827,answer,Multiple submission for project,General,,2,False,2020-09-22T01:44:52.696074+10:00,"Yes, you can submit as many times as you want up until the deadline. The latest submission will count for your grade. There is no penalty associated with how many times you submit!",Tanvi Hisaria,admin,EAnubhavR,,2345/discussion/129753
https://us.edstem.org/courses/2345/discussion/129895,post,Hi.,Social,,3,False,2020-09-21T15:03:21.844728+10:00,"Hi.

I am Teena from India. So glad that I could be part of this course with all of you. Hope to get to know all of you better in the coming days.

",TeeJac,,,,2345/discussion/129895
https://us.edstem.org/courses/2345/discussion/129895?comment=327251,post,Hi.,Social,,0,False,2020-09-22T19:17:11.3882+10:00,Hello Teena. This is Sanket form India too.,Sanket Nawale,,TeeJac,,2345/discussion/129895
https://us.edstem.org/courses/2345/discussion/130006,post,Greetings,Social,,3,False,2020-09-21T20:12:29.163964+10:00,"Hi there,

My name is Rick, I'm from the Netherlands and excited and motivated for this interesting course. I hope to interact with you in the progress of the course and wish you a succesful event.",RickJutte,,,,2345/discussion/130006
https://us.edstem.org/courses/2345/discussion/130014,post,Hello,Social,,3,False,2020-09-21T20:38:00.574429+10:00,"Hi All,

This is Furqan from the UK. I am looking forward to learning and interacting with you all throughout this course.

Best wishes!",FurqanT,,,,2345/discussion/130014
https://us.edstem.org/courses/2345/discussion/130018,question,Greetings for Everyone - Isaac Gutierrez Diaz,Social,,4,False,2020-09-21T20:50:56.391564+10:00,"Greeting for Everyone

This is Isaac Gutierrez Diaz from the Dominican Republic, I'm glad to be part of this course.

Artificial Intelligence will shape our upcoming generation And is our responsibility to understand the background and applications to solve present and future problems.

Regards

IG",IsaacGutierrezDiaz,,,,2345/discussion/130018
https://us.edstem.org/courses/2345/discussion/130049,question,Hi - Amira Obeid,Social,,1,False,2020-09-21T22:16:27.219758+10:00,"Hello :) I am Amira From Egypt but working and living in Germany, I am very Excited to start my Micro Master Program in AI on edx! currently I am in parenting leave and thought about improving my knowledge by participating in an online program until I found edx :) it's really good one as I don't need to be on site and all I need is to learn from home with my baby.. looking forward.",AmiraObeid,,,,2345/discussion/130049
https://us.edstem.org/courses/2345/discussion/130049?comment=325964,question,Hi - Amira Obeid,Social,,1,False,2020-09-22T03:34:33.007964+10:00,"Hey Amira! Just wanted to say Hi! I am Shilpa from USA. I am signed up for the micro-masters too :) 

",shilpa9g,,AmiraObeid,,2345/discussion/130049
https://us.edstem.org/courses/2345/discussion/130049?comment=327396,question,Hi - Amira Obeid,Social,,0,False,2020-09-22T22:44:09.493795+10:00,"Hello Shilpa! thanks for your comment 🙂 sounds really cool!

",AmiraObeid,,shilpa9g,,2345/discussion/130049
https://us.edstem.org/courses/2345/discussion/130071,question,SciPy and Pandas,General,,0,False,2020-09-21T22:53:33.170384+10:00,"Can you please provide links to install SciPy and Pandas.

I found this site but wanted to be sure before installing:

https://www.lfd.uci.edu/~gohlke/pythonlibs/",khushboo_choudhary,,,,2345/discussion/130071
https://us.edstem.org/courses/2345/discussion/130071?comment=325614,question,SciPy and Pandas,General,,1,False,2020-09-21T23:00:25.709935+10:00,"Just found it on the  Anaconda Navigator - Environment. pandas and scipy are pre-installed. Not sure about the version though.

",khushboo_choudhary,,khushboo_choudhary,,2345/discussion/130071
https://us.edstem.org/courses/2345/discussion/130071?comment=326433,question,SciPy and Pandas,General,,0,False,2020-09-22T08:17:42.211397+10:00,"conda install pandas 

and 

conda install scipy

should work in the terminal without downloading the wheel file from gohlke",gabergum,,khushboo_choudhary,,2345/discussion/130071
https://us.edstem.org/courses/2345/discussion/130071?answer=329749,answer,SciPy and Pandas,General,,0,False,2020-09-24T07:29:59.640892+10:00,"Hi there,

Anaconda should come with SciPy, Pandas and a bunch of other Data Science packages preinstalled. With that said, if you don't have Anaconda installed, but have Python3 along with an associated version of pip, then the following command should work on your terminal/command line:

pip install scipy pandas

If you have multiple versions of pip/Python installed, then you may have to run:

pip3 install scipy pandas


Keep in mind that we do not expect you to develop code locally. In fact, we expect you to work on Vocareum(our cloud-based development platform) for the most part. Ultimately, all submissions will have to be made there and Vocareum will have all the packages you may need.



I hope this helps.",Ashvin,admin,khushboo_choudhary,,2345/discussion/130071
https://us.edstem.org/courses/2345/discussion/130071?comment=362639,answer,SciPy and Pandas,General,,0,False,2020-10-13T00:30:25.439663+11:00,"Hi there, I joined later in this course and I have a problem installing sklearn.  I always gives me an error:

numpy.distutils.system_info.NotFoundError: No lapack/blas resources found.

I looked everywhere to find a simple way to install blas or lapack but no luck.

any luck with anybody in this class?",Codewolf,,Ashvin,admin,2345/discussion/130071
https://us.edstem.org/courses/2345/discussion/130178,post,hi - this is Priyo,Social,,2,False,2020-09-22T01:58:19.054772+10:00,"Just wanted to say hi to all.

I'm very excited about this course.

Priyo",priyochat,,,,2345/discussion/130178
https://us.edstem.org/courses/2345/discussion/130199,question,We might be doomed?,Lectures,DQ1,0,False,2020-09-22T02:38:10.855926+10:00,"If we go by the assumption that AI is developed without the school of thought of acting morally, then worries aren't unwarranted. It might be trite, but we've all seen how the AI ends up either enslaving the human race or trying to exterminate us. Taking this into account, one might wonder are we already on the path to creating our own exterminators? Throughout history, humans have consistently fought wars in one sense or another, so who's to say AI won't learn from our own history and go to war for it's perceived freedom? Only time will tell...

",aaronmcc1231,,,,2345/discussion/130199
https://us.edstem.org/courses/2345/discussion/130203,question,Hi - I'm Enrique,Social,,2,False,2020-09-22T02:46:23.919598+10:00,"Hi!

I'm currently a full-time worker in Austria and I'm from Peru. Just wanted to say hi and the best of luck to all of you!",Youheiell,,,,2345/discussion/130203
https://us.edstem.org/courses/2345/discussion/130203?comment=325898,question,Hi - I'm Enrique,Social,,0,False,2020-09-22T02:49:03.714831+10:00,"Hello, I'm living in Toronto Canada. student and part-time worker.",hamedanizad_a_h,,Youheiell,,2345/discussion/130203
https://us.edstem.org/courses/2345/discussion/130204,question,what  is markov desicion theory?,Lectures,W1,0,False,2020-09-22T02:47:11.880237+10:00,"what is markov desicion theory?

",hamedanizad_a_h,,,,2345/discussion/130204
https://us.edstem.org/courses/2345/discussion/130204?comment=326022,question,what  is markov desicion theory?,Lectures,W1,6,False,2020-09-22T04:29:13.722346+10:00,"Given the present, you don't need the past to know your future states.

$$\left(\left(p\left(s_{n+1}\right|s_n\right)\ =\ p\left(s_{n+1}\right|s_n,\ s_{n-1},s_{n-2},\ ...,\ s_0\right)$$

",ashirwadsangwan,,hamedanizad_a_h,,2345/discussion/130204
https://us.edstem.org/courses/2345/discussion/130204?comment=329348,question,what  is markov desicion theory?,Lectures,W1,1,False,2020-09-24T02:57:46.159758+10:00,"Simple and well defined.

In addition to it, the Markov Decision Theory finds it's application in Markov's Decision Process(MDP). It's a part of reinforcement learning in which random state are chosen and the corresponding reward is received.",Sanket Nawale,,ashirwadsangwan,,2345/discussion/130204
https://us.edstem.org/courses/2345/discussion/130204?comment=329828,question,what  is markov desicion theory?,Lectures,W1,1,False,2020-09-24T08:28:22.268731+10:00," @nawalesanket what do you mean by random states are chosen and corresponding rewards are received?

",ashirwadsangwan,,Sanket Nawale,,2345/discussion/130204
https://us.edstem.org/courses/2345/discussion/130204?comment=336033,question,what  is markov desicion theory?,Lectures,W1,0,False,2020-09-28T15:08:46.759213+10:00,It's a pretty in-depth topic.,Sanket Nawale,,ashirwadsangwan,,2345/discussion/130204
https://us.edstem.org/courses/2345/discussion/130204?answer=333311,answer,what  is markov desicion theory?,Lectures,W1,1,False,2020-09-26T07:16:58.675504+10:00,"You will learn more about it in the Reinforcement Learning section, but the answers above do a good job of summarizing the basic concept. The theory provides a framework for modeling decision making in an environment. The way we study this in the course, we have states which have rewards associated with them, and we have policies for each state detailing what decision to take to maximize reward. The aim is to find this policy. You will learn this in more mathematical detail later on.",Tanvi Hisaria,admin,hamedanizad_a_h,,2345/discussion/130204
https://us.edstem.org/courses/2345/discussion/130207,question,Maybe never?,Lectures,DQ2,1,False,2020-09-22T02:51:21.493435+10:00,"We're still in the early days of autonomous vehicles judging by this video:

https://www.youtube.com/watch?v=aCirDhz4jGA

It's still progress and I'm not discrediting the technological achievement, however there is a sentiment behind some of the comments on the video which I found myself intrigued by. Does the general populace even want driverless cars, or would people prefer to trust in their fellow drivers on the road? While I'm a firm believer in technology, I personally would prefer if autonomous vehicles weren't a thing in the first place for a few reasons like:

Machines do in fact fail, just like us. They're not infallible.

I personally don't believe AI could make a moral decision on the road if it came down to it (i.e Trolley problem)

",aaronmcc1231,,,,2345/discussion/130207
https://us.edstem.org/courses/2345/discussion/130207?comment=327393,question,Maybe never?,Lectures,DQ2,0,False,2020-09-22T22:40:57.006003+10:00,"I personally don't believe AI could make a moral decision on the road if it came down to it (i.e Trolley problem)

It is interesting that you should mention the trolley problems in relation to morality as almost all the scenarios can be justified in some way despite the decision a person would make. In the problems, both action and inaction are arguably moral decisions, and with access to large masses of information in the moment, which is something that humans are incapable of achieving, one could say that AI would make a better 'informed decision'. Of course, the sentiment that humans might involve in making decisions can't quite be replicated by AI, and if we were to say that moral decisions that take sentiment into account are of higher quality, then you would be right in saying that AI could not make the best moral decision.",quarcoopome-junior_t,,aaronmcc1231,,2345/discussion/130207
https://us.edstem.org/courses/2345/discussion/130209,question,Hi,Social,,1,False,2020-09-22T02:56:19.306477+10:00,"Hi everyone, I'm Tyler from NYC. Here to prepare for PhD. Look forward to class and interacting with you!",Tyler Franklin,,,,2345/discussion/130209
https://us.edstem.org/courses/2345/discussion/130209?comment=325955,question,Hi,Social,,0,False,2020-09-22T03:30:53.617995+10:00,Hello Tyler! I am Shilpa. I am signed up for the whole AI micro-master program. I plan to study further too. I am interested to learn about your learning path. Thanks!,shilpa9g,,Tyler Franklin,,2345/discussion/130209
https://us.edstem.org/courses/2345/discussion/130229,question,Hello,Social,,0,False,2020-09-22T03:23:34.002097+10:00,I am Armstrong from Cameroon. I am happy to take this course. I hope to learn from you all,Mbiagbor,,,,2345/discussion/130229
https://us.edstem.org/courses/2345/discussion/130230,question,A warm hello to all the new friends!,Social,,1,False,2020-09-22T03:24:10.169787+10:00,"Hi, I am Shilpa, from Washington, USA. I am interested in learning how to make machines intelligent. This course is a step in the journey.  I look forward to our interactions. Cheers!

",shilpa9g,,,,2345/discussion/130230
